,Unnamed: 0.1,Unnamed: 0,timestamp,coin,proposal,proposal_type,initial_price,time_5_day,time_5_price,price_high,timestamp_high,percent_high,average_price,average_percent,category
1275,1275,1275,2022-05-08 16:29:23+00:00,pankcakeswap," The text suggests implementing a small fee for creating a proposal, using a virtual currency called ""cake."" This fee is intended to discourage frivolous proposals and encourage serious ones. If a proposal or part of it is adopted, the creator gets their cake back; otherwise, the cake is ""burned"" (effectively lost). This system aims to reduce distractions from valuable proposals, prevent duplicate proposals, and ensure that only genuine proposers pay the fee. The cost for making a proposal is set at one unit of cake.",bearish,7.005,2022-05-09 00:00:00+00:00,5.56,5.56,2022-05-09 00:00:00+00:00,-0.2062812276945039,6.133333333333333,-0.1244349274327861,verySmall
1277,1277,1277,2024-03-14 17:25:44.574000+00:00,aave," Olympix proposes a collaboration with Aave, offering security tooling for future deployments. The company, a web3 security firm dedicated to developer-first solutions, aims to ensure security as a top priority in DeFi product development.

The proposed tools include:
1. Static Analyzer: Assists developers in finding bugs early using static analysis and protocol knowledge.
2. Unit + Invariant Test Generator: Increases productivity by automating test creation for smart contract code, reducing bias and ensuring comprehensive coverage.

This partnership enhances Aave developers' testing processes, prioritizing security, and strengthening the integrity of their smart contracts. Ongoing communication and support will be maintained to improve tools based on feedback from Aave developers. The invitation is open for discussions regarding tool capabilities and usage.",bearish,139.42,2024-03-16 00:00:00+00:00,116.1,116.1,2024-03-16 00:00:00+00:00,-0.1672643810070291,129.10333333333332,-0.0739970353368717,verySmall
1284,1284,1284,2023-08-16 07:52:09+00:00,aave," Title: wGHO Onboarding in Aave V3 Ethereum Pool

Author: Marc Zeller (Aave Chan Initiative, Chaos Labs)

Date: 2023-08-09

Summary: This proposal aims to integrate wGHO, an ERC-20 token wrapper of GHO, as a collateral-only asset in a new stablecoin emode within Aave V3 Ethereum pool. The integration will enable using wGHO as collateral for borrowing stablecoins like USDC, USDT, DAI, and LUSD, facilitating arbitrage and leveraged positions during under-peg GHO situations. This move enhances the Aave ecosystem by providing tools to maintain the GHO peg. wGHO will only be available to borrow DAI, USDC, LUSD & USDT, not for collateral of GHO. The proposal sets specific parameters for the integration and creation of a dedicated stablecoin emode on Aave V3 ETH pool for wGHO, USDC, USDT, DAI, LUSD.",bearish,60.38,2023-08-17 00:00:00+00:00,50.0,50.0,2023-08-17 00:00:00+00:00,-0.1719112288837363,57.21666666666667,-0.0523904162526222,verySmall
1287,1287,1287,2024-08-04 11:29:51.199000+00:00,arbitrum," The text discusses the future of the STEP diversification program, a project that aims to diversify Arbitrum's treasury into Real-World Assets (RWAs). The plan is to establish a Steering Committee to guide this initiative and outline Arbitrum's broader RWA strategy. The goal is to allocate at least 1% of ArbitrumDAO’s treasury into RWAs annually for five years.

The Steering Committee will consist of members with backgrounds in RWA Issuers, Treasury Managers, Crypto-Native Funds, Crypto-Native Financial Advisors, Legal Firms, RWA Infrastructure, and individuals with Capital Markets expertise. The committee will identify topics for the next phase (STEP II) and define Arbitrum's overall RWA strategy.

The community is encouraged to participate in bi-weekly meetings and provide feedback. The first meeting is scheduled for August 13th. The formation, composition, and work of the Steering Committee will not be remunerated initially, but a budget may be proposed later based on identified tasks. The RWA Innovation Grants program (RWAIG) is separate from STEP and will align with the Steering Committee's plans once it ends.",bearish,0.5651,2024-08-05 00:00:00+00:00,0.4287,0.4287,2024-08-05 00:00:00+00:00,-0.24137320828172,0.5165333333333333,-0.0859434908275822,verySmall
1294,1294,1294,2020-08-31 12:02:56+00:00,curve," dForce plans to introduce a dToken pool (dUSDx/dDAI/dUSDC/dUSDT). dToken is a yield aggregator by dForce, offering high yields in the market (e.g., 12.1% for USDT, 6.1% for USDC and DAI as of Aug 31) through gas optimization strategies. Participants can farm DF tokens via dForce Staking Portal or add a dToken pool on Curve, providing liquidity and earning both DF and CRV tokens, with a combined yield potential of up to 170%. This is an additional incentive for LPs on Curve.",bearish,4.337,2020-08-31 00:00:00+00:00,3.423,3.423,2020-08-31 00:00:00+00:00,-0.2107447544385519,3.858666666666666,-0.110291291983706,verySmall
1295,1295,1295,2023-11-09 02:02:22+00:00,apecoin," The text discusses a proposal by Bored Brewing to integrate ApeCoin into their beer packaging. This includes creating an ApeCoin-themed beer, QR codes on all cans providing information about the DAO and ApeCoin, and collaborations with other NFT collections. The benefits include marketing ApeCoin to crypto/NFT communities and spreading awareness among non-crypto beer drinkers. The cost is estimated at $175,000 USD, which will be used for ApeCoin educational initiatives, free beer, and a branded beer contest. The proposal is subject to changes for security, usability, and to protect APE holders. The full proposal can be found on the ApeCoin forum.",bearish,1.387,2023-11-09 00:00:00+00:00,1.15,1.15,2023-11-09 00:00:00+00:00,-0.170872386445566,1.4193333333333331,0.0233117039173275,verySmall
1296,1296,1296,2023-02-13 14:22:59.797000+00:00,makerdao," The document discusses MIP40c3-SP96, a proposal to modify the Data Insights Core Unit Budget (DIN-001). The proposal aims to determine whether assets produced by this unit using funding from MakerDAO will be made public goods for the DAO. Questions include if appropriate licenses will be applied, copyright assigned to the Dai Foundation, and communication channels used for MakerDAO representation. Additionally, it asks if trademarks representing MakerDAO-funded solutions will be transferred to the Dai Foundation.",bearish,770.0,2023-02-13 00:00:00+00:00,654.0,654.0,2023-02-13 00:00:00+00:00,-0.1506493506493506,756.3333333333334,-0.0177489177489176,verySmall
1302,1302,1302,2023-12-11 23:47:49.698000+00:00,optimism," The Anticapture Commission is set to elect a new Lead during Season 5. The Lead must be a non-current Council Lead, draft internal procedures, organize meetings, execute votes, author or coordinate reports, calculate qualifying delegates, decide in case of lack of consensus, and self-nominate by January 2nd. Self-nominations should include delegate commitment link, voting power, participation rate, voting history, contributions to the Optimism ecosystem, relevant experience, potential conflicts, agreement to removal via Representative Removal proposal, and acknowledgement of being a signer on the Commission's multi-signature wallet. The Lead will be elected via simple majority vote between January 4th - January 11th.",bearish,2.292,2023-12-11 00:00:00+00:00,1.91,1.91,2023-12-11 00:00:00+00:00,-0.1666666666666666,2.294666666666666,0.0011634671320535,verySmall
1305,1305,1305,2021-05-26 03:35:56+00:00,badger," The proposed text suggests a decision on the multiplier for the addition of ibBTC/WBTC SLP Setts in the general emission structure. A 1.5x multiplier would maintain current reward levels, while a 2x multiplier would align it with byWBTC Sett long-term rewards. Higher multipliers mean a larger percentage of rewards are reallocated from other non-native Setts to ibBTC SLP Sett. The discussion can be found at this link: https://forum.badger.finance/t/bip-58-emissions-ibbtc-wbtc-slp-sett-incentives/4706. Voting is required to decide on the chosen multiplier.",bearish,14.885,2021-05-28 00:00:00+00:00,10.999,10.999,2021-05-28 00:00:00+00:00,-0.2610681894524689,13.358333333333334,-0.1025641025641024,small
1306,1306,1306,2023-11-11 17:47:45+00:00,pankcakeswap," Prediction suggests Bitcoin will reach $50,000 by 2024.",bearish,2.367,2023-11-11 00:00:00+00:00,1.948,1.948,2023-11-11 00:00:00+00:00,-0.1770173215040135,2.216666666666667,-0.0635121813829037,verySmall
1307,1307,1307,2021-12-02 19:39:58.383000+00:00,makerdao," The Content Production Core Unit has been active over the last three weeks despite a Thanksgiving break. Highlights include onboarding legal counsel, transitioning to QuickBooks for payments, and publishing several videos such as [Maker Relay] Monthly Governance Review, The State of Dai, AMA Learn About Maker Wormhole, and a promotional video for Maker Wormhole.

Content production is ongoing for ETH Denver, with planning for the Welcome Party, intros for calls/meetings, and updates to various dashboards. Other efforts include building a Reddit scraper, meeting with teams for collaboration on ETH Denver side events, and preparing for upcoming job ads in Video Production, Audio Production, and Social Media Management.

Looking ahead, the team plans to announce details for the ""Welcome to Denver"" event at ETH Denver, reorganize for the new year strategy, and publish a ""How-to-Vote"" video on the Governance manual. Regular updates can be found on the Transparency Dashboard 13 and weekly Office Hours on Tuesdays at 14:30 UTC.",bearish,2973.0,2021-12-04 00:00:00+00:00,2257.0,2257.0,2021-12-04 00:00:00+00:00,-0.2408341742347796,2779.0,-0.0652539522367978,verySmall
1313,1313,1313,2022-04-29 22:41:30.194000+00:00,aragon,"1. The proposed structure includes committees for various functions such as project applications, appointments, governance, membership, ethics, grants & projects, administrative panel, treasury panel, and technical panel. These committees are elected by the members' assembly or appointed by other committees in an indirect democracy fashion.

2. The structure allows for higher majorities for changes of important matters in the articles of association by the members’ assembly and/or additional approval by a specific committee for significant decisions such as changing the purpose of the association or liquidation.

3. Committees can create sub-committees, like guilds, which are supervised by the respective committees. For example, the technical committee could introduce sub-committees for each guild.

4. The funding of development companies such as Aragon labs can become subject to a vote by the members’ assembly (ANT token holders).

5. A formal request will be made to the Aragon Association to adopt the proposed revised articles of association and merge the Aragon Network DAO into the Aragon Association.

6. FAQ addresses questions about the use of a legal entity, potential risks, and reasons for the proposal. The association would provide flexibility in structuring and legal certainty, mitigate the risk of being subject to various jurisdictions worldwide, and protect assets from freezing by authorities under specific circumstances.

7. The IP rights and access credentials to online services would belong to the association and thus indirectly the members as the highest governing body, with ANT holders having the final say in this regard.

8. An AMA session will be held to provide further explanations and address concerns about the proposal.",bearish,3.611,2022-04-30 00:00:00+00:00,3.057,3.057,2022-04-30 00:00:00+00:00,-0.1534201052340072,3.4036666666666666,-0.057417151296963,verySmall
1314,1314,1314,2022-11-10 17:42:00.611000+00:00,makerdao," The latest edition of the Collateral Status Index (CSI) is presented, divided into four sections based on the Collateral Onboarding (COB) process:

1. Collateral Application Status - Includes all collateral applications before prioritization, such as Application, Poll Active, Greenlit, or those withdrawn, postponed, or deferred.
2. Prioritized Collateral - The section for collateral prioritized to move into the Assessment step of the COB process, determined by various factors including MIP6 application completeness and alignment with MakerDAO strategic objectives.
3. Collateral Work In Progress (WIP) - Contains collateral working through the Assessment to Executive Vote statuses, including Assessment, Gov Poll Active, Gov Poll Passed, Implementation, Exec Active, and those not passing governance polls or executive votes.
4. Active Collateral - Includes all collateral applications in Business Review or Active status, recently offboarded, or undergoing offboarding.

The CSI spreadsheet is the primary source of information for collateral moving through the COB process, updated by a limited number of collateral stakeholders to ensure data integrity. If discrepancies are found, they should be reported via the #collateral-engineering-services-public channel on the official MakerDAO Discord server. For specific collateral questions or comments, use the MakerDAO forum within the collateral application forum post. General questions about the CSI update can be posted here.",bearish,882.0,2022-11-10 00:00:00+00:00,661.0,661.0,2022-11-10 00:00:00+00:00,-0.2505668934240362,788.0,-0.1065759637188208,small
1315,1315,1315,2021-09-19 08:55:15+00:00,pankcakeswap," In this system, burning 100 units of cake results in 50 being instantly lost, while the other 50 is redistributed to previous burnout users. This redistributed cake can be claimed. Investors receive a lifetime investment that continuously produces cake. This process likely generates good returns for users and reduces circulating supply. The numbers given are examples and could vary. Burning more cake is suggested as a long-term strategy to lock it up.",bearish,22.78,2021-09-20 00:00:00+00:00,18.7,18.7,2021-09-20 00:00:00+00:00,-0.1791044776119403,19.936666666666664,-0.1248170910155108,verySmall
1321,1321,1321,2024-08-05 16:52:09.438000+00:00,balancer," The Decentralized Autonomous Organization (DAO) is assessing its Balancer (BAL) holdings due to their decline. A detailed analysis has been prepared to quantify and budget for available reserves by the end of 2024, considering service provider renewals, additional BAL allocation proposals, and strategic partnerships. The current total BAL holdings across all chains, vaults, and liquidity positions is 4,520,786.

Expected inflows include 242,286 BAL from the termination of Wonderland's collaboration with the Balancer DAO. Expected outflows for the second half of 2024 include service provider expenses and karpatkey fees based on BIP-648.

Planned additional BAL deployments/commitments in 2024 include a CoW<>BAL partnership, a market making strategy to improve CEX liquidity, and several pending proposals on the forum.

After accounting for expected inflows and outflows, an estimated 3,295,929 BAL will remain by the end of the year. However, earmarking $1.25 million worth of BAL for the self-insurance fund will leave approximately 2,689,756 BAL available for future endeavors by the end of 2024. The balances needed to cover engagements quoted in dollar value can vary over time due to fluctuations in BAL value.",bearish,1.796,2024-08-05 00:00:00+00:00,1.522,1.522,2024-08-05 00:00:00+00:00,-0.1525612472160356,1.812333333333333,0.0090942835931699,verySmall
1324,1324,1324,2023-05-23 18:54:00+00:00,pankcakeswap," Earn ZETA tokens by completing tasks on Zealy.io platform, available on Binance, Bybit, OKX, Mexc, and other exchanges from May 30, 2023.",bearish,1.807,2023-05-25 00:00:00+00:00,1.515,1.515,2023-05-25 00:00:00+00:00,-0.1615938018815716,1.6643333333333334,-0.0789522228371148,verySmall
1327,1327,1327,2022-07-21 19:07:10+00:00,optimism," The Governance Fund Phase 1 proposal is eligible for voting in Cycle 4, but approval by a delegate is not guaranteed. For more information, refer to Voting Cycle 4 Roundup. Proposal link: [Governance Fund Phase 1 proposal - Gard](https://gov.optimism.io/t/ready-gf-phase-1-proposal-gard/3024).",bearish,0.776,2022-07-21 00:00:00+00:00,0.651,0.651,2022-07-21 00:00:00+00:00,-0.1610824742268041,0.8503333333333334,0.0957903780068728,verySmall
1329,1329,1329,2022-06-09 13:44:24+00:00,balancer," Balancer has deployed BAL on Optimism in collaboration with BeethovenX, aiming to utilize veBAL gauges for BAL emissions. To facilitate arbitrage between Ethereum and Optimism, it's proposed to allocate BAL from the treasury for liquidity on Multichain, which requires liquidity to function. The treasury currently holds approximately 4M BAL. This move could potentially earn bridge fees but carries risks such as potential exploitation of Multichain leading to loss of BAL and users only bridging in one direction, draining bridge liquidity on one side and preventing withdrawal of BAL. If approved, 40,000 BAL will be sent from the DAO Multisig to the LM Multisig for depositing on both sides of the bridge.",bearish,7.48,2022-06-11 00:00:00+00:00,6.13,6.13,2022-06-11 00:00:00+00:00,-0.1804812834224599,6.9433333333333325,-0.0717468805704101,verySmall
1332,1332,1332,2023-02-13 14:05:36.547000+00:00,makerdao," The document discusses the GovAlpha Core Unit's budget proposal for 2023-2024, funded by MakerDAO. The proposal includes questions about the use of assets produced with MakerDAO funding, specifically concerning their availability as public goods within the DAO. Questions also address the application of Open Source Software/Creative Commons licenses, copyright assignment to the Dai Foundation, integration of the Dai Foundation Contributor License Agreement Assistant in Github repositories, and making source code/material publicly available. Additionally, the proposal discusses communication channels, ownership of relevant websites, email, and social media accounts, and the registration of trademarks for MakerDAO-funded solutions.",bearish,770.0,2023-02-13 00:00:00+00:00,654.0,654.0,2023-02-13 00:00:00+00:00,-0.1506493506493506,756.3333333333334,-0.0177489177489176,verySmall
1335,1335,1335,2024-01-09 14:49:30.650000+00:00,lido," StarkWare is planning to deploy wstETH (Wrapped staked ETH) onto Starknet, aiming for recognition of the wstETH bridge endpoints as canonical by Lido DAO. The deployment aims to boost opportunities within the DeFi ecosystem and increase demand for wstETH across various platforms.

Starknet, an Ethereum scaling solution, has grown significantly over the past year, becoming the 8th largest blockchain developer community among all L2s. Starknet's potential in the DeFi ecosystem is high, creating a significant demand for wstETH.

The current wstETH bridge to Starknet is via StarkGate, with all components being upgradeable. Starkware will enable cross-chain governance, allowing Lido to govern the bridge's wstETH, expected by Q2 2024. The relevant source code and audits will be made available for transparency and accessibility to the Lido community.

As a leading Ethereum scaling solution, Starknet sees high demand for adopting wstETH, opening up opportunities for users to utilize stETH holdings in various DeFi protocols. The recognition of wstETH bridge endpoints as canonical by Lido DAO will enhance the DeFi ecosystem within Starknet and increase the adoption of wstETH.

The community is encouraged to engage in discussions and provide feedback during this development process.",bearish,3.639,2024-01-09 00:00:00+00:00,3.049,3.049,2024-01-09 00:00:00+00:00,-0.1621324539708711,3.6863333333333337,0.0130072364202621,verySmall
1340,1340,1340,2022-08-25 19:08:08+00:00,optimism," The Committee Formation Proposal is open for voting in Special Voting Cycle #5, categorized under DeFi. Up to 4 committees will be approved for Season 2 based on votes across all categories. To promote diversity, the Optimism Foundation suggests delegates vote ""yes"" for their top 1-2 committees per category. For more details, visit the Governance Committees introduction page.",bearish,1.178,2022-08-27 00:00:00+00:00,0.989,0.989,2022-08-27 00:00:00+00:00,-0.1604414261460101,1.0733333333333333,-0.0888511601584606,verySmall
1349,1349,1349,2022-06-09 13:43:44+00:00,balancer," The proposal seeks to include GnosisDAO's treasury in Balancer's VotingEscrow contract, enabling participation in Balancer governance and voting on gauges. GnosisDAO has a partnership with Balancer and has contributed liquidity to the protocol, accumulating 1MM BAL. The proposal lists three Gnosis Safe wallets for this purpose.",bearish,7.48,2022-06-11 00:00:00+00:00,6.13,6.13,2022-06-11 00:00:00+00:00,-0.1804812834224599,6.9433333333333325,-0.0717468805704101,verySmall
1350,1350,1350,2022-11-10 07:55:11.489000+00:00,aave," B.Protocol has proposed adding a user-based backstop for GHO in Aave to enhance liquidation mechanics and ensure peg stability, especially for less liquid collaterals during market volatility. The backstop will allow users to deposit their GHO into a pool, providing liquidity for smooth liquidations with a fixed slippage. This setup aims to protect Aave from bad debt created by GHO while strengthening GHO stability and potentially earning profits from liquidations.

The backstop is designed to facilitate the liquidation of less liquid collateral assets on Aave V2, reducing the risk of bad debt exposure for the protocol during market downturns. It will also improve the liquidation process for illiquid assets, fostering trust in new stablecoins during severe market conditions.

To incentivize GHO holders to participate in the backstop, B.Protocol suggests allocating $3m as an incentive or setting the backstop as another eligible source for discounted interest rates for GHO. The community will decide on the specific parameters for these incentives.

B.Protocol invites feedback from the Aave community regarding this proposal and its preferred method to incentivize GHO backstoppers. Once approved, B.Protocol will initiate development efforts for the integration.",bearish,68.0,2022-11-10 00:00:00+00:00,57.0,57.0,2022-11-10 00:00:00+00:00,-0.1617647058823529,63.36666666666667,-0.0681372549019607,verySmall
1351,1351,1351,2024-04-11 11:22:58.344000+00:00,starknet," The text proposes a method for encoding StarkNet transactions into QR codes, enhancing wallet interaction with StarkNet transactions. This method simplifies the transaction signing process, making it more accessible and efficient. Developers can encode transactions using provided methods and generate QR codes. The QR code format includes the transaction type, ID, and parameters. Implementation involves modifying an existing Ethereum-QR-code generator to encode StarkNet transactions as QR codes. This approach ensures backward compatibility with existing StarkNet transactions and provides two library implementation options: a separate qrcode library or integration with existing solutions like ethereum-qR-code. The proposal emphasizes user confirmation, one-time use of QR codes, and minimizing sensitive information in QR codes for security and privacy reasons.",bearish,1.826,2024-04-12 00:00:00+00:00,1.305,1.305,2024-04-12 00:00:00+00:00,-0.2853231106243155,1.5896666666666668,-0.1294267981014968,small
1358,1358,1358,2024-03-13 06:51:04.670000+00:00,balancer," Abdul, leading Business Development for Monad Labs, proposes deploying Balancer on the upcoming high-performance EVM-equivalent blockchain, Monad. The testnet launch is planned for Q2 and mainnet for Q4 this year. Balancer's liquidity bootstrapping pools and advanced AMM features align well with Monad's low fees and high throughput. Deployment on both testnet and mainnet will enhance Balancer's position in the DeFi space. The collaboration aims to bring advanced DeFi capabilities to a growing ecosystem, uniting two vibrant communities. Monad is an EVM-equivalent blockchain built with a focus on performance, introducing optimizations for high throughput (10,000 tps) and preserving full EVM equivalence. It offers seamless compatibility with Ethereum tools and applications, making it an attractive choice for developers and users alike.",bearish,6.039,2024-03-15 00:00:00+00:00,5.133,5.133,2024-03-15 00:00:00+00:00,-0.1500248385494286,5.75,-0.0478556052326543,verySmall
1359,1359,1359,2024-07-03 14:31:23.805000+00:00,uniswap," Michigan Blockchain is a student-led organization at the University of Michigan focused on blockchain technology since 2019. They offer educational and professional development opportunities, along with project-based experiences. Over six years, they've partnered with over 20 organizations and managed $30M in delegations. Their governance team actively participates in voting and proposal development for Uniswap, Arbitrum, Compound, Origin Protocol, and Stader Labs. By delegating to them, you enable your tokens to contribute to innovation on decentralized exchanges. They aim to set a standard for decentralized community participation, particularly with Uniswap. Their values include fostering an inclusive community, ensuring sustainability, promoting open communication, and prioritizing flexibility. Potential conflicts of interest include their active governance contributions to ARB, COMP, OGN, and SD.",bearish,8.522,2024-07-05 00:00:00+00:00,6.763,6.763,2024-07-05 00:00:00+00:00,-0.2064069467261206,7.975333333333332,-0.0641476961589612,verySmall
