,Unnamed: 0.1,Unnamed: 0,timestamp,coin,proposal,proposal_type,initial_price,time_5_day,time_5_price,price_high,timestamp_high,percent_high,average_price,average_percent,category
657,657,657,2024-06-05 12:52:37+00:00,balancer," This proposal aims to activate a 2% capped gauge for an 80% D2D / 20% GYD pool on the Arbitrum Network. The collaboration is between PrimeDAO and Gyroscope, moving liquidity from the ETH Mainnet D2D / USDC pool to a pool using GYD on Arbitrum. This change may increase volumes for both pools.

PrimeDAO is a DAO-builder collective that has launched various products like Prime Rating, Prime Launch, and Inverter Network. It is governed by holders of D2D and pooled D2D through Snapshot Votes and Forum Proposals. The proposal does not use oracles; instead, it uses Coingecko. The Treasury functions are controlled by Prime Governance, with contracts being non-upgradable.

The Balancer Maxi LM Multisig will interact with the GaugeAdderv4 and call the addGauge function with the specified gauge address (0xBC5E2f2945Ff4a6568C4DBD3aA15D9e8FfDF0125) and gaugeType (Arbitrum).",bearish,4.118,2024-06-07 00:00:00+00:00,3.5,3.5,2024-06-07 00:00:00+00:00,-0.1500728508984944,3.9696666666666673,-0.0360207220333494,verySmall
662,662,662,2022-05-10 09:20:27.721000+00:00,astar," Title: Introduction to JPYC (JPYCoin), Japan's First Yen Stablecoin

   JPYCoin, the first Japanese Yen Stablecoin, utilizes blockchain technology and maintains a 1:1 parity with the Japanese yen. It operates on multiple networks including Ethereum, Astar, Polygon, Gnosis, and Avalanche. Users can store it in wallets like Metamask or trade it on platforms such as Uniswap.

   The project is compliant with Japan's Payment Act Law. JPYC Inc. is the team behind its development. More information can be found on their website (https://jpyc.jp/).

   Milestones achieved include issuing $10M worth of JPYC across multiple chains, collaborating with DEXs for liquidity mining, and launching farming campaigns on Arthwap, a major DEX on Astar.

   Future plans involve collaboration with DeFi projects on Astar, enabling cross-chain compatibility, going public on the Japanese Tosho Market, and forming partnerships with other stablecoin companies to enhance on/off ramp adoption.",bearish,0.1064,2022-05-11 00:00:00+00:00,0.0562,0.0562,2022-05-11 00:00:00+00:00,-0.4718045112781954,0.0763999999999999,-0.2819548872180452,medium
664,664,664,2024-03-09 11:36:59.574000+00:00,apecoin," To participate in ApeCoin voting on Snapshot, follow these steps:

1. Access Snapshot site.
2. Connect your digital wallet containing ApeCoins.
3. Authenticate yourself to prove ApeCoin ownership without spending transaction fees.
4. Find the proposal you wish to vote on and vote for or against it. Your vote is proportional to the number of ApeCoins you hold.
5. Each ApeCoin equals one vote in the ApeCoin DAO voting process, allowing democratic participation in decisions concerning the ApeCoin ecosystem.",bearish,2.27,2024-04-02 00:00:00+00:00,1.701,1.701,2024-04-02 00:00:00+00:00,-0.2506607929515418,2.0930000000000004,-0.0779735682819381,small
669,669,669,2024-07-02 12:09:49.401000+00:00,starknet," The post discusses two main issues and proposed solutions within the Starknet decentralized protocol, focusing on forced staking updates and empty blocks.

1. Forced Staking Updates:
   - Problem: Delay in resetting the protocol due to forced staking updates can take more than 24 hours.
   - Solution: Make a proof a ""public good"" as soon as it is computed, adding it to a common pool of proofs available to all nodes. This avoids issues related to forced staking updates and introduces a new component into the protocol.

2. Empty Blocks:
   - Problem: Proposers can propose empty blocks, which may lead to censoring transactions or damaging the quality of the chain.
   - Solution: Decrease rewards for consecutive empty blocks proposed by the same node, but not for the first time an empty block is proposed. This discourages nodes from proposing (only) empty blocks when not necessary.

The post concludes by inviting feedback on these reflections to improve the robustness of the Starknet protocol.",bearish,0.637,2024-07-04 00:00:00+00:00,0.526,0.526,2024-07-04 00:00:00+00:00,-0.1742543171114599,0.5973333333333333,-0.0622710622710623,verySmall
670,670,670,2021-05-30 01:22:08+00:00,uniswap," User Chris Blec announced a departure from the DeFi community for a $50M offer, expressing readiness to proceed.",bearish,25.716,2021-05-30 00:00:00+00:00,21.66,21.66,2021-05-30 00:00:00+00:00,-0.1577228184787681,27.19366666666667,0.0574609840825426,verySmall
672,672,672,2020-12-19 17:30:49+00:00,curve," Curve Finance proposes SCIP-25, a StETH pool upgrade for improved Ethereum liquidity.",bearish,0.664,2020-12-21 00:00:00+00:00,0.54,0.54,2020-12-21 00:00:00+00:00,-0.1867469879518072,0.6126666666666667,-0.0773092369477911,verySmall
680,680,680,2021-11-25 13:45:42+00:00,pankcakeswap,"1. PancakeSwap (PCS) needs to cease promoting Binance Coin (BNB) and focus on Chainlink Coin (CAKE).
   2. PCS should stop limiting itself to one blockchain and adopt a multi-chain approach, as other platforms have.
   3. Improve website speed for better user experience.
   4. PCS needs to acquire part of the liquidity and strengthen its treasury for development purposes.
   5. PCS should increase burns or reduce emissions to combat market saturation with CAKE.
   6. PCS should focus on its core strengths such as Launchpad, Initial Farm Offerings (IFO), farming, etc., rather than pursuing trends like NFTs.
   7. Only farms involving CAKE pairs should pay out in CAKE; other farms should use their native tokens to avoid inflationary pressure and potential high selling pressure from users opting not to choose CAKE.",bearish,14.42,2021-11-26 00:00:00+00:00,12.0,12.0,2021-11-26 00:00:00+00:00,-0.1678224687933426,13.463333333333331,-0.0663430420711974,verySmall
693,693,693,2024-01-03 15:40:56.808000+00:00,arbitrum," The document presents a proposal for the distribution of 125,000 $ARB tokens as retroactive rewards to 24 dedicated and earliest contributors to the Arbitrum community, known as Arbiters. These individuals have provided significant service to the Arbitrum community over the past two years.

The proposed distribution method is equal for all 24 arbiters, with each receiving approximately 5,208.333 $ARB tokens. One of the arbiters, Discord ID BILLY#7943, has voluntarily relinquished their award and split it equally amongst the other arbiters, resulting in a change from 25 arbiters to 24.

The Arbitrum DAO will collect wallet addresses through a designated process for reward distribution. If approved, the rewards will be distributed to each Arbitrator Contributor's address after thorough verification and validation.

This proposal is part of an initiative to recognize and appreciate the valuable contributions made by the Arbiters to the community, aiming to revitalize engagement, promote openness, and encourage continued participation. The long-term sustainability of the Arbitrum community is a priority in this effort.

The document also includes lists of partial contributions and individual contribution information for each Arbiter, as well as a detailed description and breakdown of their application for retroactive rewards. These resources are provided to allow DAO delegates to check updates on the Arbiters' contributions.

Lastly, the document encourages feedback and interaction from the community in shaping its future. The goal is to build a more collaborative, innovative, and vibrant Arbitrum community that reflects the values and spirit of the ecosystem.",bearish,1.9137,2024-01-03 00:00:00+00:00,1.463,1.463,2024-01-03 00:00:00+00:00,-0.2355123582588701,1.9565666666666663,0.0223998885231053,verySmall
697,697,697,2023-05-06 20:23:36+00:00,pankcakeswap," Proposal for a smart contract-based index pool allowing simultaneous staking of 'cake' across all pools, earning rewards in either BNB or BUSD. Staked cake is proportionally distributed among existing and future pools. A fee system is proposed to contribute to burning.",bearish,2.2,2023-05-08 00:00:00+00:00,1.834,1.834,2023-05-08 00:00:00+00:00,-0.1663636363636364,2.0276666666666667,-0.0783333333333333,verySmall
698,698,698,2024-07-03 11:27:28.323000+00:00,starknet," The text discusses the author's enthusiasm for Starknet, comparing it to Ethereum's early days. However, they experienced hostility from friends for expressing this support in a group setting. The author attributes this negativity to poor communication between the project team and community, suggesting that community members feel unheard and undervalued. The text concludes with a quote emphasizing the importance of small contributions, such as a nail saving a horse, which can have significant impacts on larger entities.",bearish,0.622,2024-07-04 00:00:00+00:00,0.526,0.526,2024-07-04 00:00:00+00:00,-0.1543408360128617,0.5563333333333333,-0.1055734190782422,verySmall
701,701,701,2024-07-02 20:51:27.007000+00:00,uniswap," The document outlines a proposal to deploy the Uniswap interface on two emerging Ethereum Layer-2 networks, Linea and Scroll, at a total cost of 10k $UNI. The initial development costs include UI/UX design, front-end development for swap, account component, liquidity management, slippage settings, local token whitelisting function, smart-routing, block explorer support, i18n, transaction data page, and embedded bridge aggregator functionality.

For each network integration, 5k $UNI will be allocated for business development and marketing efforts. This includes leveraging DapDap’s existing DeFi partner network, integrating local DeFi services into DapDap's Uniswap-focused interface, focused marketing campaigns using social media and influencers, hosting community events, and simplifying the user experience through onboarding campaigns.

The expected outcomes include improved accessibility to Uniswap’s liquidity pools, enhanced user engagement, increased liquidity provision and trading volume, and enhanced penetration into Layer-2s via frontend composability. DapDap will provide quarterly reports on user activity after launch.

The mockups provided show the designs for swap, pool, third-party vaults, and bridge interfaces within the DapDap-Uniswap integration. The proposal is presented as a discussion point, with the intention of collaboration and boosting participation in the Ethereum Layer-2 DeFi space if there is sufficient support.",bearish,9.0,2024-07-04 00:00:00+00:00,7.587,7.587,2024-07-04 00:00:00+00:00,-0.157,8.383333333333333,-0.0685185185185185,verySmall
702,702,702,2020-10-03 15:48:12.408000+00:00,uniswap," The text discusses concerns about the perceived weakness of Uniswap's governance compared to other projects like YFI. Issues mentioned include lack of proposals for voting, difficulties in submitting proposals due to requirements, and a general feeling that the governance forum is more of a fan project than something serious. The author suggests that Uniswap's Development team should take more action, such as promoting the governance portal through social media, actively discussing proposals, and ensuring progress is made. They also request feedback on their suggestions. The author mentions that if this post is locked, they would appreciate guidance on how to modify it for further discussion.",bearish,3.9041,2020-10-05 00:00:00+00:00,3.1817,3.1817,2020-10-05 00:00:00+00:00,-0.1850362439486693,3.649766666666667,-0.065145189245494,verySmall
705,705,705,2021-12-02 17:38:55+00:00,balancer," The proposal aims to transfer control of Balancer DAO's treasury from Balancer Labs to a decentralized autonomous organization (DAO) multisig, enhancing decentralization. The DAO multisig will execute legitimately passed snapshot votes and not have decision-making powers. The current list of signers includes several notable figures in the crypto space, with Kevin Owocki retiring. Replacements are proposed, including Danielmk (BeethovenX) and Bakamoto. A 500 BAL stipend will be provided to signers every six months. Upon approval, treasury funds will be transferred to the DAO multisig address, with a gnosis safe on Fantom created to hold Balancer DAO's BEETS allocation. Some BAL from past grant waves may not be transferred due to remaining allocation.",bearish,20.07,2021-12-04 00:00:00+00:00,12.89,12.89,2021-12-04 00:00:00+00:00,-0.3577478824115595,18.51333333333333,-0.0775618667995348,small
706,706,706,2022-08-29 17:18:14.912000+00:00,lido," Lido is seeking input from potential relay providers interested in collaborating with their protocol. The goal is to refine Lido's relay policy through collective discussion with these providers and DAO stakeholders. To mitigate operational risks, a trustworthy list of relays will be established for use by Lido Node Operators. This ""must-include list"" will consist of vetted, reliable relays. A second, less stringent list called the ""allow list"" will include approved but less well-known or tested relays. Both lists will be public and editable.

Relays must be publicly available, listed, open source, and transparent about any transaction or address filtering they enforce. Lido is encouraging interested relay providers to express their intent, provide organizational background, explain why their relay should be approved, and contribute to the discussion on Lido's relay policy.

As of February 10, 2023, the relay list is maintained on-chain in a relevant contract. A full list of relay providers and their status can be found on the Relay Maintenance Committee public page. Updates have been made to the Goerli relay details for Eden, Ultrasound.money, and Aestus, with mainnet additions planned once sufficiently tested.",bearish,1.882,2022-08-29 00:00:00+00:00,1.55,1.55,2022-08-29 00:00:00+00:00,-0.1764080765143463,1.8843333333333327,0.0012398157987957,verySmall
708,708,708,2023-03-11 03:52:07.769000+00:00,makerdao," On Coinbase, there's an unusual drop in the peg of DAI below .97 and a 10% decrease in MKR. This suggests potential volatility or issues affecting these cryptocurrencies.",bearish,722.0,2023-03-11 00:00:00+00:00,595.0,595.0,2023-03-11 00:00:00+00:00,-0.1759002770083102,842.3333333333334,0.1666666666666667,verySmall
710,710,710,2021-01-22 16:59:26+00:00,balancer," This proposal aims to increase the GNO cap tier from cap3 to cap4 ($10M to $30M) due to consistently high GNO adjusted liquidity since December 2020. With over $22M in total liquidity on Balancer Pools, Gnosis seeks to strengthen ties with Balancer for the upcoming launch of Gnosis Protocol V2, a Meta Dex-Aggregator. Gnosis currently holds significant BAL tokens, intending to transfer them to GnosisDAO as an investment. The proposal aims to keep incentivizing Balancer to avoid liquidity fragmentation and maintain its competitive advantage as the most liquid exchange for GNO. GNO is the governance token of GnosisDAO, a rapidly growing Ethereum infrastructure component that owns several core Ethereum components and will soon launch Gnosis Protocol V2.",bearish,19.95,2021-01-22 00:00:00+00:00,16.843,16.843,2021-01-22 00:00:00+00:00,-0.1557393483709273,21.20233333333333,0.0627736006683374,verySmall
711,711,711,2022-06-10 20:03:36.780000+00:00,0xprotocol, Discussion about project proposals for 0x Starter Project is ongoing. Proposals are invited for building decentralized exchange solutions on Ethereum blockchain.,bearish,0.3608,2022-06-12 00:00:00+00:00,0.2967,0.2967,2022-06-12 00:00:00+00:00,-0.177660753880266,0.3301666666666666,-0.0849039172209904,verySmall
712,712,712,2024-07-03 11:04:36.149000+00:00,balancer," The second quarter of 2024 focused on improving core infrastructure for reward distribution and allocation, with significant progress made as outlined in the Q2 funding proposal. Key achievements include:

1. Fee Sweep Automation: A new bal_tools repository was refactored, reducing workload and enabling over $750k in fees to be shipped monthly without major incidents.

2. vlAURA Voting: An automated solution for voting incentives was developed, improving transparency and reducing errors. Automatic relocking of the position is yet to be developed.

3. OZ Defender Migration: The code base was successfully migrated to OZ Defender v2, with improvements in gas usage and upgrades completed.

4. Rewards Injector v2: Smart contract development for the new version has been completed, with integration tests underway. Expected to go live in Q3 2024.

5. Gauges and Core pools: Automatic core pool detection was integrated into the code base, with cross-referencing of YB token requirements and rate provider reviews upcoming.

Additional development work included advising partners on DAO treasury data and maintaining DeFilytica analytics and tooling deployments for Balancer and AURA DAOs. The Maxis dedicated an additional $15,365 discretionary budget to various work packages in June, with savings of $51,000 anticipated for Q3.

Looking ahead, the focus will be on supporting Balancer v3 design, improving partner onboarding guides, setting up a Zen UI beta testing program, and ensuring seamless user experiences while maintaining secure on-chain operations.",bearish,2.664,2024-07-05 00:00:00+00:00,2.165,2.165,2024-07-05 00:00:00+00:00,-0.1873123123123123,2.4716666666666667,-0.0721971971971972,verySmall
719,719,719,2021-05-30 02:36:39.133000+00:00,uniswap," The text discusses a proposal aimed at removing an individual named Chris Blec from the DeFi community. The author considers Blec influential due to his opinions and skepticism, but suggests that his removal would be advantageous for all members, particularly underage developers. This proposition is based on a suggestion made by Blec himself: offering him 50 million dollars. Given the Uniswap treasury's substantial funds ($4B) and Hayden Adams' expressed dislike for Blec, the author proposes using UNI tokens from the treasury to fulfill this request. A snapshot poll is available for voting on this proposal, with the deadline approaching soon.",bearish,25.716,2021-05-30 00:00:00+00:00,21.66,21.66,2021-05-30 00:00:00+00:00,-0.1577228184787681,27.19366666666667,0.0574609840825426,verySmall
729,729,729,2024-07-03 01:52:32.091000+00:00,uniswap," This text discusses various proposals made by GFX Labs regarding the Uniswap platform, including onboarding new chains (Sei, Manta), operational improvements, delegate compensation, and funding requests for DeFi Education Fund (DEF). The proposals aim to streamline new deployments, attract high-quality delegates, and provide additional funding for DEF. GFX Labs voted in favor of most proposals, except for the onboarding of Redstone due to its limited TVL and market position. The text also mentions a matching funds request from Uniswap Arbitrum's LTIPP program, with varying amounts requested and recommended by GFX Labs. Overall, the text highlights GFX Labs' involvement in decision-making for Uniswap and its related projects.",bearish,8.522,2024-07-05 00:00:00+00:00,6.763,6.763,2024-07-05 00:00:00+00:00,-0.2064069467261206,7.975333333333332,-0.0641476961589612,verySmall
731,731,731,2021-03-02 15:13:20+00:00,curve," The proposal aims to incorporate governance tokens like COMP, UNI, YFI into Curve DAO pools. The motivation is to utilize idle tokens for voting, thereby enhancing quorum and empowering Curve DAO or delegated entities. Proponents argue it allows for strategic voting in future collaborations between DAOs. Critics express concerns over increased gas fees and potential bias in voting positions contrary to liquidity providers' interests.",bearish,2.508,2021-03-02 00:00:00+00:00,1.981,1.981,2021-03-02 00:00:00+00:00,-0.210127591706539,2.291,-0.0865231259968102,verySmall
741,741,741,2022-12-15 19:30:59+00:00,optimism,"90 community members will receive voting badges in the newly announced retroPGF 2, including 10 Token House delegates. For more details, refer to the original post and Token House Badgeholder Election Information on Optimism's governance forum.",bearish,1.067,2022-12-17 00:00:00+00:00,0.896,0.896,2022-12-17 00:00:00+00:00,-0.1602624179943767,0.9863333333333334,-0.0756013745704466,verySmall
742,742,742,2024-06-06 23:31:55+00:00,apecoin," The text proposes hiring a Head of Network Development for the APE Foundation to support strategic goals, daily operations, and external affairs. This role will also coordinate community engagement and make recommendations for improvements. The position is not equivalent to a CEO or leader but a critical support function.

The hire will be funded by reducing future Special Council members' payments. The estimated annual salary is $120,000 in APE, with the possibility of exceeding this amount if deemed necessary. The APE Foundation will manage the hiring process, ensuring all legal and tax considerations are addressed.

The addition of a Head of Network Development is beneficial for the ApeCoin DAO as it will provide essential oversight, strategic facilitation, and operational management, ensuring the DAO fulfills its mission efficiently and effectively. This role is crucial for maintaining momentum, building community trust, and ensuring the long-term sustainability of the DAO. The proposal can be found at [AIP-413 link removed].",bearish,1.33,2024-06-07 00:00:00+00:00,1.1,1.1,2024-06-07 00:00:00+00:00,-0.1729323308270676,1.2153333333333334,-0.0862155388471178,verySmall
744,744,744,2021-07-18 08:24:10+00:00,pankcakeswap," Newly released cryptocurrencies are quickly listed on significant exchanges. Currently, Cake is not yet available for trading on OKEx, Bitstamp, Coinbase Pro, Gemini, Bitfinex, bitFlyer, btcturkpro, ParibuCom, HuobiGlobal, Bybit_Official, Upbitglobal, HitBTC, Bitmex, Kraken, ZBG_Exchange, bitforexcom, and LBank_Exchange.",bearish,12.93,2021-07-20 00:00:00+00:00,10.85,10.85,2021-07-20 00:00:00+00:00,-0.1608662026295437,12.064,-0.0669760247486465,verySmall
748,748,748,2020-07-31 23:20:18.118000+00:00,compound," A Community Multisig has been deployed in the Compound Protocol Discord, proposed by user @arr00, with six community members as potential signers. The purpose of this multisig is to be used as a Pause Guardian or Borrow Limit Guardian in the future. The multisig is currently being confirmed by the proposed signers, who will then be added to the multisig. Once confirmed and approved through governance, the multisig can be utilized within the protocol for various purposes.",bearish,134.63,2020-08-02 00:00:00+00:00,110.0,110.0,2020-08-02 00:00:00+00:00,-0.1829458515932555,129.73999999999998,-0.0363217707791726,verySmall
750,750,750,2024-07-02 08:38:28.348000+00:00,starknet," This text describes a proposed implementation of Zero Knowledge Governance (ZK Governance) for the Starknet ecosystem, focusing on privacy and anonymity in governance processes. The ZK Governance system includes:

1. Voting Process: After voting ends, coordinators verify and process messages in batches using zk-SNARK proofs to ensure correct decryption and state tree updates without retaining outdated votes. Tallying of votes is done offline with another zk-SNARK proof for transparency.

2. Verification: The verifier contract on Starknet validates the proofs, ensuring the messages were processed correctly.

3. Results Publication: Once all messages are processed and verified, the voting results can be announced, and anyone can verify their accuracy using zk-SNARK proofs. Individual votes remain confidential to protect privacy.

4. Integration with Starknet’s Governance Platform: ZK Governance will be integrated into the existing governance platform to provide a privacy layer, encouraging higher participation rates and improving the quality of decision-making.

5. Key Deliverables: An anonymous forum section and an anti-censorship/anonymous voting mechanism are planned as part of this integration.

6. Benefits for Starknet Ecosystem: Implementing ZK Governance is expected to lead to higher participation rates, stronger community engagement, improved decision-making, enhanced security, and a more vibrant ecosystem overall.

7. References: The proposal references research by Vitalik Buterin, gubsheep, and Sun Yi on minimal anti-collusion infrastructure, ZK Identity, and MACI (Minimal Anti-Collusion Infrastructure).",bearish,0.637,2024-07-04 00:00:00+00:00,0.526,0.526,2024-07-04 00:00:00+00:00,-0.1742543171114599,0.5973333333333333,-0.0622710622710623,verySmall
753,753,753,2024-07-06 13:24:26.363000+00:00,starknet," The text discusses a proposed new syscall, get_class_hash_at or class_hash_syscall, for Starknet's smart contract environment. This syscall aims to retrieve the class hash of a deployed contract at a specific address within the contract execution environment.

Currently, there is no way to perform this operation within the smart contract itself. In contrast, Ethereum and EVM systems store copies of the code multiple times if the same contract is deployed numerous times.

The motivation for this syscall comes from the need to check a contract's class hash, as seen in Kakarot's use of replace_class_hash syscall for upgrades at the contract level and using class hashes as a means of checking contract versions. This syscall would enable contract-level orchestration of versioning and auto-upgrade for Kakarot Account Contracts.

The proposed API for this syscall includes two options: get_class_hash_at_syscall and class_hash_syscall, both returning the ClassHash if the contract is deployed and an error if it is not. The implementation details are yet to be defined by the Starkware team.

The text also mentions that copyright and related rights have been waived via MIT.",bearish,0.573,2024-08-02 00:00:00+00:00,0.407,0.407,2024-08-02 00:00:00+00:00,-0.2897033158813263,0.5066666666666666,-0.1157649796393252,small
