,Unnamed: 0.1,Unnamed: 0,timestamp,coin,proposal,proposal_type,initial_price,time_5_day,time_5_price,price_high,timestamp_high,percent_high,average_price,average_percent,category
1,1,1,2024-03-04 18:50:24+00:00,aave," Title: Proposal to Add gmBTC on Arbitrum Aave v3 Liquidity Pool

   Author: 0xlide - SaucyBlock, dated 2024-02-05

   Summary: The proposal aims to integrate gmBTC (a BTC-USD's Liquidity Token on the GMX V2) as a collateral asset in the Aave V3 Arbitrum Pool. This integration could potentially create new demand for borrowable assets on Aave V3. The parameters for gmETH and gmBTC are provided, with key features such as Collateral Enabled, Supply Cap, LTV, and Liquidation Bonus specified. The proposal progresses through ARFC stages if consensus is reached and risk service providers approve the risk parameters. The project details, GitHub, Docs, Audit, Twitter, Discord links are provided for reference.",bearish,114.14,2024-03-05 00:00:00+00:00,93.86,93.86,2024-03-05 00:00:00+00:00,-0.1776765375854214,115.80666666666666,0.0146019508206295,verySmall
8,8,8,2022-08-25 19:09:04+00:00,optimism," The ""DeFi"" Committee Formation Proposal is open for voting in Special Voting Cycle #5. Up to 4 committees will be approved for Season 2, with delegates encouraged to vote for their top 1-2 per category for diversity. For more details, visit the Governance Committees introduction at gov.optimism.io.",bearish,1.178,2022-08-27 00:00:00+00:00,0.989,0.989,2022-08-27 00:00:00+00:00,-0.1604414261460101,1.0733333333333333,-0.0888511601584606,verySmall
9,9,9,2022-08-17 19:18:37.068000+00:00,balancer," Balancer may develop tools to aid institutions in managing assets, addressing regulatory concerns associated with public pool usage.",bearish,6.52,2022-08-19 00:00:00+00:00,5.51,5.51,2022-08-19 00:00:00+00:00,-0.1549079754601226,6.1000000000000005,-0.0644171779141102,verySmall
10,10,10,2024-06-06 13:39:55.203000+00:00,venus," Orbiter Finance is a decentralized data communication service built on ZK-tech and Ethereum, enabling instant, secure, and efficient cross-rollup transactions of Ethereum-native assets. It supports multiple networks such as Ethereum, zkSync Era, Arbitrum, Optimism, Polygon, and more. With over 3.8 million users, 23 million transactions, and a daily transaction volume of over $22 million, Orbiter Finance aims to enhance user experiences and unlock new functionalities through its OpenAPI documentation. The team looks forward to collaborations on this exciting journey.",bearish,11.66,2024-06-07 00:00:00+00:00,9.56,9.56,2024-06-07 00:00:00+00:00,-0.1801029159519725,10.966666666666669,-0.0594625500285877,verySmall
17,17,17,2021-05-03 13:51:57.164000+00:00,makerdao," Blog post discusses the impact of artificial intelligence on various industries, citing examples and potential benefits such as increased efficiency and productivity. It also warns about potential risks like job displacement and privacy concerns, suggesting the need for regulation and ethical guidelines.",bearish,5981.71,2021-05-03 00:00:00+00:00,4911.17,4911.17,2021-05-03 00:00:00+00:00,-0.1789688901668586,5545.063333333334,-0.0729969635215792,verySmall
19,19,19,2024-03-14 20:03:32.529000+00:00,aave," Alphaday, a platform developed by Aave Grantees, offers a comprehensive solution for managing cryptocurrencies across devices. It features portfolio tracking, real-time market updates, personalized news and insights, and a customizable user interface. The platform consolidates various crypto sources into a single dashboard, making it easier to stay informed in the rapidly changing crypto space. Alphaday is free and highly customizable, allowing users to tailor their dashboard layout. Access Alphaday at [website link removed].",bearish,139.42,2024-03-16 00:00:00+00:00,116.1,116.1,2024-03-16 00:00:00+00:00,-0.1672643810070291,129.10333333333332,-0.0739970353368717,verySmall
25,25,25,2024-03-04 12:18:16.899000+00:00,balancer," Fringe Finance has launched its V2 platform, introducing features that benefit $BAL token holders. The new version offers leveraged trading (Margin Trade and Amplify), a dynamic interest rate model for higher yields, the ability to repay loans using collateral, expanded asset availability across multiple chains, and an incentive program to reward lenders. The incentive program is structured around TVL milestones, with rewards issued in FRIN tokens based on a lender's proportion of total interest earned. This program aims to stimulate adoption by offering triple rewards: from $BAL token growth, lender interest, and rewards from the program itself.",bearish,5.304,2024-03-05 00:00:00+00:00,4.488,4.488,2024-03-05 00:00:00+00:00,-0.1538461538461538,5.347666666666666,0.0082327802916036,verySmall
27,27,27,2021-11-25 19:34:40+00:00,pankcakeswap," The Wolfible Token distribution consists of 2 Million tokens, with 50% reserved for the Initial Farm Offering (IFO) on PancakeSwap, locked for 48 months and 30% for DAO. 25% is allocated for liquidity, farms, reward pools, and 10% each for marketing, team, and charity, with vesting periods. Wolfible is an NFT platform that aims to facilitate easy and affordable creation of NFTs, with a focus on community ownership through the native governance token $WOFT. For more information, visit the project's official channels: website, documentation, Twitter, and Telegram. To join the IFO on PancakeSwap, follow the provided guide.",bearish,14.42,2021-11-26 00:00:00+00:00,12.0,12.0,2021-11-26 00:00:00+00:00,-0.1678224687933426,13.463333333333331,-0.0663430420711974,verySmall
31,31,31,2022-03-17 03:44:21+00:00,pankcakeswap," The text discusses a proposal for Cake (CAKE) to expand its presence across multiple blockchain networks, such as Polygon, Ethereum, and Avalanche. This expansion involves making the Pancakeswap protocol accessible on these chains and offering CAKE tokens for purchase. The BNB Chain will continue to be the primary network with ongoing management and development, while cross-chain Pancakeswap aims to generate additional trading fees and boost CAKE token awareness. Additionally, the text suggests initial seed liquidity pools for CAKE on each new chain it enters.",bearish,6.75,2022-03-17 00:00:00+00:00,5.53,5.53,2022-03-17 00:00:00+00:00,-0.1807407407407407,6.526666666666667,-0.0330864197530863,verySmall
32,32,32,2022-05-04 07:36:03+00:00,aave," The community is requesting support to list sAVAX as a collateral asset, which is the Liquid Staking token from BENQI protocol on the Avalanche network. sAVAX allows users to unlock liquidity while participating in securing the Avalanche network and generates revenue through network validation rewards. It has over 3M sAVAX in circulation with deep liquidity in Automated Market Makers (AMMs) for a healthy lending market ecosystem.

BENQI is a Liquid Staking solution that allows users to stake AVAX to receive sAVAX, which then delegates the staked AVAX to nodes for network validation, generating approximately 7.20% APR. sAVAX can be redeemed back for AVAX after a 15 days cooldown period in a 2 days redemption window.

Using sAVAX as a collateralized asset on AAVE would increase interest earned on supplying and reduce the cost of borrowing due to its yield-bearing nature. It is integrated with various protocols like Anchor, Kyber, Trader Joe, Ribbon, and Platypus.

BENQI was launched in 2021 as DeFi activity on the Avalanche network grew, and it supports another layer of DeFi primitive, Liquid Staking. Over $200M is being staked via BENQI, with over $100M of liquidity across AMMs.

The asset currently used includes over 3M AVAX (~ $200M) being staked via BENQI and over $100M of liquidity across AMMs. sAVAX is integrated by protocols such as Anchor, Platypus, Ribbon Finance, More Money, Trade Joe, Kyber, and Pangolin.

The market cap of sAVAX is $168M, with a 24hr volume of $2.2M. It is listed on exchanges like Trader Joe, Kyber, and Pangolin. The number of transactions is 59,902, and the number of holders is 4,070.

The social channels data shows that BENQI has a Twitter following of 62.9k and a Telegram following of 13.35k. The contracts were deployed on January 27, 2022, with no emission schedule. sAVAX cannot be minted without staking AVAX in the contract, and a multisig is currently the owner of the minting contract, which belongs to BENQI's core team.

The architecture of sAVAX uses a pool share system, and the withdrawal and delegation process is protected in a hardened memory-only runtime environment with no remote access and extremely restricted physical access. The architecture is currently transitioning into a distributed, multi-party computational system to ensure security and consensus for transaction execution.",bearish,159.5,2022-05-06 00:00:00+00:00,132.8,132.8,2022-05-06 00:00:00+00:00,-0.167398119122257,146.4333333333333,-0.0819226750261234,verySmall
33,33,33,2021-12-02 00:23:02.136000+00:00,makerdao," ACREinvest is a blockchain venture focused on Web3 infrastructure, virtual network services, and social incentives for DAOs. The delegate address from Dec 2021 to Nov 2022 is 0x4d3aC33AB1dd7B0F352b8E590Fe8b62c4C39eAd5, and the delegate address for Nov 2022 - Nov 2023 is 0x06e8dedf9e1adb1eba32f36ea9223770ba378b77. The venture is led by Kianga Daverington, the founder of Acre of America, an impact investment management firm.

ACREinvest's mission is to revolutionize capital markets and aims to apply two decades of legal experience in derivatives and commodities markets to DeFi, specifically MakerDAO. The venture has launched ACRE DAOs, a Web3 portal for a decentralized impact investment club and its related ERC-20 token: ACRE Impact.

ACREinvest operates with core values of Creativity, Common Sense, and Compliance. Kianga pledges to keep the community updated on any potential conflicts of interest and agrees to abide by the Delegate Code of Conduct. However, her role is not in her professional capacity as an attorney, and none of her comments or communications should be considered legal advice.

By delegating MKR to ACREinvest, individuals acknowledge that neither Kianga Daverington nor ACREinvest are liable for any damages or losses related to the delegation of MKR. It is the responsibility of the individual to understand the risks and costs associated with delegating their MKR.",bearish,2973.0,2021-12-04 00:00:00+00:00,2257.0,2257.0,2021-12-04 00:00:00+00:00,-0.2408341742347796,2779.0,-0.0652539522367978,verySmall
41,41,41,2021-05-06 20:53:10+00:00,sushi," The Sushi team has secured 16 million dollars (approx.) in incentives from Polygon and xDai foundations to boost liquidity. Two proposed solutions for matching these funds are using a portion of the existing treasury (over 200 million dollars) or lowering incentives for certain pairs at the core team's discretion. The Sushi team also secured 1 million dollars in incentives from xDai, aiming to foster more liquidity and users across various networks. This move is aimed at positioning Sushi as a leading DEX on multiple locations, with all revenues benefiting xSushi holders. For now, the team suggests leveraging the treasury due to technical complexity in bridging emissions.",bearish,16.512,2021-05-06 00:00:00+00:00,13.963,13.963,2021-05-06 00:00:00+00:00,-0.1543725775193799,16.212333333333333,-0.0181484173126615,verySmall
45,45,45,2024-06-05 15:31:18.883000+00:00,apecoin," The project aims to develop an avatar generator tool with customizable 3D traits, optimized for ApeCoin's ecosystem. The development will include:

1. Design of accessories, 3D sculpture, optimization, texturing, rigging, and quality assurance for the 3D segment.
2. Minting campaigns of the traits using smart contracts in ApeChain, ensuring security and quality assurance for the blockchain development.
3. Adapting the current tech to a new ApeCoin UI, fitting the avatar generator system to the traits, and maintaining the website with UI/UX Design, Frontend Development, Backend Development, and Quality Assurance.

The project will be developed by separate in-house teams over 12 months, starting from August 2024 to December 2025. The milestones include:

- UI/UX designed and published.
- Base avatar designed, developed, and published.
- Traits/Accessories designed, developed, and published.
- Launch of the tool.
- Publication of guides on how to use the avatars.

The key performance indicators (KPIs) will be:

- Number of avatars created.
- Unique wallets that have created an avatar.
- Content impressions with the avatars being used.

The total cost of the project is estimated to be $370,000, including salaries, licenses for tools, hardware and server costs, and other associated expenses. The breakdown of the costs is as follows:

- Blockchain Dev: $60,000
- 3D Programming: $60,000
- Graphic Design: $10,000
- Frontend Development: $40,000
- Backend Development: $80,000
- 3D modelling & texturing (same artists): $90,000
- Rigging: $30,000

The APE Foundation will be required to grant access to a subdomain for hosting the project or offer their 3D Avatar Platform as a host for one year. The community will also be involved in suggesting and requesting traits they'd like to see.

Reporting expectations include bi-weekly updates on progress and a public Notion page visible to anyone with the progress on minor and major milestones. Updates will be released throughout the year, with new accessories being added each month.",bearish,1.362,2024-06-07 00:00:00+00:00,1.1,1.1,2024-06-07 00:00:00+00:00,-0.1923641703377386,1.2956666666666667,-0.0487028879099363,verySmall
52,52,52,2020-09-11 00:48:44+00:00,sushi," The text discusses a rebranding proposal for SushiSwap, a popular cryptocurrency project, following recent events involving ChefNomi and the devfund. The community is encouraged to submit new logo designs in a contest called ""The SushiSwap Dragonroll Logo Contest."" The winning design will become the new SushiSwap logo, with the winner being titled ""Master of Dragonrolls"" and receiving 500 $SUSHI. Second and third place winners will also receive prizes in $SUSHI. The community will vote on the top 5 submissions to determine the final design.",bearish,2.711,2020-09-11 00:00:00+00:00,2.028,2.028,2020-09-11 00:00:00+00:00,-0.2519365547768351,2.5563333333333333,-0.0570515185048567,small
59,59,59,2022-04-08 17:04:18+00:00,balancer," The proposal aims to whitelist the COW/ETH pool gauge for veBAL voting, strengthening ties between COW and BAL communities. The COW Protocol allows users to swap assets at optimal exchange rates by delegating trade execution to solvers, who compete to offer the best possible rate. This batching of trades reduces gas costs, AMM fees, and execution risk, resulting in better prices than existing DEX aggregators. The COW Protocol is governed by its token holders and has undergone audits for its settlement contract and COW token. However, it still relies on a centralized server for orderbook and solver competition, with plans to decentralize this aspect in the future. COW was launched with incentives for providing liquidity on Balancer pools, and is now considering using veBAL voting to boost BAL rewards for COW pools.",bearish,20.25,2022-04-10 00:00:00+00:00,16.78,16.78,2022-04-10 00:00:00+00:00,-0.1713580246913579,18.52333333333333,-0.0852674897119343,verySmall
60,60,60,2021-06-19 09:55:11.905000+00:00,makerdao," Discussion needed on potential funding for reducing risks for participants in active Credit Unions, with numerous feasible opportunities identified by a corporate attorney.",bearish,2582.32,2021-06-21 00:00:00+00:00,2071.14,2071.14,2021-06-21 00:00:00+00:00,-0.1979537779980793,2459.896666666667,-0.0474082736970372,verySmall
61,61,61,2021-03-02 17:13:53+00:00,curve," This text is about Uniswap, an on-chain trading protocol that allows for free creation, trading, and provision of liquidity via Automated Market Maker (AMM). Users can access it through the Uniswap website, Discord, Twitter, or GitHub. The token associated with Uniswap is UNI, and more information can be found on Coingecko. The Ethereum address for Uniswap is 0x1f9840a85d5af5bf1d1762f925bdaddc4201f984.",bearish,2.508,2021-03-02 00:00:00+00:00,1.981,1.981,2021-03-02 00:00:00+00:00,-0.210127591706539,2.291,-0.0865231259968102,verySmall
63,63,63,2024-06-16 15:48:28.340000+00:00,apecoin," The text discusses a proposal for ApeID, a web2/web3 login system similar to AppleID, Facebook Login, and Google Login. This system aims to onboard users to any site, whether they hold ApeCoin or not, and allow ApeCoin holders to connect their wallets. The benefits include mass adoption and exposure for ApeCoin, acting as a potential loyalty card for web3, and potentially making ApeCoin the coin of choice for other web3 businesses. The system will be built by an experienced team and is expected to take 4-5 months for V1. Updates will be provided quarterly, and costs will include software development, marketing, advertising, and tech support. This proposal serves as a foundation for a larger vision for ApeID.",bearish,1.085,2024-06-18 00:00:00+00:00,0.868,0.868,2024-06-18 00:00:00+00:00,-0.1999999999999999,1.005,-0.0737327188940092,verySmall
70,70,70,2022-06-15 19:15:09.203000+00:00,makerdao," The text provides updates on various projects within the MakerDAO ecosystem. Highlights include:

1. sETH2 Technical Assessment published with a high risk rating, leading to a decision by CMON stakeholders not to invest further until mitigations are in place.
2. Maple Finance and HVB Technical Assessments are undergoing feedback rounds and will be published soon.
3. An on-chain poll for offboarding 5 Ilks passed, with coordination towards an executive vote scheduled for the week of June 22nd.
4. CES supported SGF developers in testing operations for a vault deployed on the CES Goërli environment.
5. The Collateral Onboarding Process (COB) has been redefined and updated, with new internal sheets created to coordinate activities across teams.
6. A Quick Start Guide was published to facilitate understanding of the onboarding process and make it a self-service approach.
7. Various meetings are ongoing among different teams for updates and decision-making processes.
8. The CES Budget Cycle has been published, and previous sprint updates have been shared.
9. Engagement with the community is encouraged through Discord.",bearish,828.0,2022-06-15 00:00:00+00:00,679.0,679.0,2022-06-15 00:00:00+00:00,-0.179951690821256,776.6666666666666,-0.0619967793880837,verySmall
77,77,77,2020-08-31 15:59:26+00:00,curve," A new hBTC/wBTC pool is being added to Curve for increased BTC liquidity on Ethereum. The pool, optimized for gas efficiency and without lending, attracts more liquidity, enabling easier swaps between the two assets. This should boost liquidity for all Bitcoin forms on Curve.",bearish,4.337,2020-08-31 00:00:00+00:00,3.423,3.423,2020-08-31 00:00:00+00:00,-0.2107447544385519,3.858666666666666,-0.110291291983706,verySmall
78,78,78,2021-07-18 17:17:39+00:00,pankcakeswap," Prioritize the development of perpetual contract transactions (margin transactions). A portion of the handling fee is destroyed, using CAKE tokens.",bearish,12.93,2021-07-20 00:00:00+00:00,10.85,10.85,2021-07-20 00:00:00+00:00,-0.1608662026295437,12.064,-0.0669760247486465,verySmall
82,82,82,2021-09-05 17:46:00+00:00,pankcakeswap," Proposal: Expand PancakeSwap across multiple blockchains, establishing decentralized exchanges (DEX) on each and potentially launching its own chain.",bearish,24.47,2021-09-07 00:00:00+00:00,18.35,18.35,2021-09-07 00:00:00+00:00,-0.2501021659174498,23.276666666666667,-0.0487671979294373,small
84,84,84,2023-05-06 01:50:55+00:00,pankcakeswap, Text suggests discussing whether participants who extended their trust in the project by locking tokens for another year are deserving of a reward.,bearish,2.2,2023-05-08 00:00:00+00:00,1.834,1.834,2023-05-08 00:00:00+00:00,-0.1663636363636364,2.0276666666666667,-0.0783333333333333,verySmall
89,89,89,2024-04-10 05:52:01+00:00,aave," Title: Polygon v2 Borrow Rate Adjustments Proposal
   Authors: @karpatkey_TokenLogic & @ChaosLabs
   Date: 2024-04-04

This publication proposes gradually increasing borrow rates on Polygon v2 to encourage users to migrate to Aave v3. The Reserve Factor (RF) on Polygon v2 has increased over the past 8 months, reducing capital efficiency and deposit yield.

The proposal suggests incrementing the Slope1 parameter for non-frozen assets by 75bps every two weeks to encourage migration from v2 to v3. The Uoptimal will also be adjusted periodically to discourage new debt positions.

For frozen assets, the Uoptimal will be reduced to 10%, Slope1 to 50%, and Slope2 to 500% (except for BAL with a Uoptimal of 20% due to current utilization).

The changes will not trigger liquidation of users' funds and will gradually increase the cost for those remaining on v2. A migration tool is available to aid transition from v2 to v3.

Assets affected: DAI, MATIC, wBTC, wETH, USDC, USDT, BAL, CRV, DPI, GHST, LINK, and SUSHI.

The proposal will be escalated to the Snapshot stage if community consensus is reached. If approved, a subsequent proposal will be submitted every two weeks.",bearish,128.5,2024-04-12 00:00:00+00:00,86.86,86.86,2024-04-12 00:00:00+00:00,-0.3240466926070039,115.30333333333331,-0.1026977950713359,small
94,94,94,2023-04-14 08:46:41.407000+00:00,venus,"10 USDT will be converted to 9 VAI considering the exchange rate of min(1, 0.9). If a user wants to send 10 USDT to PSM, they will receive 9 VAI after fees (assuming feeIn = 10%), with 1 VAI going to the treasury and 8.1 VAI going to the user. The commission is calculated based on the principal amount of VAI (9 VAI = $9).

The VAI Savings Rate (VSR) contract is a smart contract designed to accept deposits of VAI tokens and mint SavingsVAI for depositors. This contract provides users with the opportunity to earn interest on their VAI deposits, while also providing additional utility to the VAI token within the Venus ecosystem.

Key features of the VSR contract include:
- Deposit and mint: Users deposit VAI into the VSR contract, which mints and issues SavingsVAI tokens to the depositor based on the deposit amount of VAI.
- Redeem and withdraw: Users can redeem their SavingsVAI tokens at any time, receiving VAI in return. The amount of VAI received upon redemption will always be equal to or greater than the initial VAI deposit used to obtain the SavingsVAI tokens.
- SavingsVAI: SavingsVAI is an ERC-20 token that represents a redeemable deposit within the VSR contract. The redemption process is guaranteed and immediate, without any lock-up periods.
- Implementation of ERC-4626: The VSR contract can implement the ERC-4626 standard (ERC-4626: Tokenized Vaults), where VAI serves as the resource and SavingsVAI functions as shares.

The VAI Savings Rate contract introduces an additional level of utility for VAI, allowing users to earn interest on their deposits. This mechanism not only encourages the holding of VAI but also improves the overall value proposition of the Venus ecosystem.

In conclusion, this proposal aims to keep the pegged VAI price at $1 by deploying the VAI PEG Stability module and providing liquidity for the VAI/USDT pair on PancakeSwap. The plan begins with the use of treasury for providing liquidity on PancakeSwap and continues with further developments, such as Peg Stability Modules, VAI Savings Rate, and updates to the liquidation sequence.",bearish,7.99,2023-04-14 00:00:00+00:00,6.75,6.75,2023-04-14 00:00:00+00:00,-0.1551939924906133,7.88,-0.0137672090112641,verySmall
95,95,95,2021-05-11 19:44:18.589000+00:00,makerdao,3-part series on MakerDAO resources concludes with information about Collateral and Liquidations. Previous parts covered related topics.,bearish,5368.7,2021-05-13 00:00:00+00:00,4439.66,4439.66,2021-05-13 00:00:00+00:00,-0.1730474789055078,5021.633333333333,-0.0646463141294292,verySmall
98,98,98,2024-05-20 18:24:26+00:00,arbitrum," A proposal by Cattin (Seed Latam) requests 500,000 ARB for a challenge due to its potential impact. The initial application and an addendum can be found on the Arbitrum Foundation forum. Further details are available in the discussion threads provided.",bearish,1.1269,2024-05-20 00:00:00+00:00,0.9476,0.9476,2024-05-20 00:00:00+00:00,-0.1591090602537936,1.1572000000000002,0.026887922619576,verySmall
101,101,101,2022-12-15 21:35:43+00:00,apecoin," The text discusses the nomination process for the ApeCoin DAO's Special Council, established by AIP-137. Community members have been discussing and providing feedback on nominees since November 28th. Voting is now open to choose the 5 candidates who will proceed to the Special Council election, scheduled from Dec 22-28. The process is administered by the Ape Foundation, with potential changes for security, usability, or to protect APE holders. More details can be found on the nomination announcement and nominee profiles posted on Discourse.",bearish,3.976,2022-12-17 00:00:00+00:00,3.254,3.254,2022-12-17 00:00:00+00:00,-0.18158953722334,3.660333333333333,-0.07939302481556,verySmall
